{
  "event_id": "6e5d4c3b-2a19-4807-a6b5-c4d3e2f1b002",
  "event_type": "submission.processed.v1",
  "schema_version": 1,
  "occurred_at": "2026-10-30T08:30:00.123456Z",
  "user_id": "3f2b8c1e-5a4d-4e7b-9c10-2d6f8a9b0c11",
  "trace_context": {
    "traceparent": "00-4bf92f3577b34da6a3ce929d0e0e4736-00f067aa0ba902b7-01"
  },
  "payload": {
    "submission_id": "9a8b7c6d-5e4f-4a3b-8c2d-1e0f9a8b7c6d",
    "study_session_id": "5c4d3e2f-1a0b-4c9d-8e7f-6a5b4c3d2e1f",
    "run_id": "2d1c0b9a-8f7e-4d6c-9b5a-4e3f2d1c0b9a",
    "result_key": "users/3f2b8c1e-5a4d-4e7b-9c10-2d6f8a9b0c11/sessions/5c4d3e2f-1a0b-4c9d-8e7f-6a5b4c3d2e1f/results/2d1c0b9a-8f7e-4d6c-9b5a-4e3f2d1c0b9a.json"
  }
}
