{
  "event_id": "6e5d4c3b-2a19-4807-a6b5-c4d3e2f1a000",
  "event_type": "document.uploaded.v1",
  "schema_version": 1,
  "occurred_at": "2026-10-25T08:30:00.123456Z",
  "user_id": "3f2b8c1e-5a4d-4e7b-9c10-2d6f8a9b0c11",
  "trace_context": {
    "traceparent": "00-4bf92f3577b34da6a3ce929d0e0e4736-00f067aa0ba902b7-01"
  },
  "payload": {
    "document_id": "0b9e8d7c-6f5a-4b3c-9d2e-1f0a9b8c7d6e",
    "subject_id": "7a1c2e3f-4b5d-4c6e-8f70-91a2b3c4d5e6",
    "object_key": "users/3f2b8c1e-5a4d-4e7b-9c10-2d6f8a9b0c11/subjects/7a1c2e3f-4b5d-4c6e-8f70-91a2b3c4d5e6/raw/9f86d081884c7d659a2feaa0c55ad015a3bf4f1b2b0b822cd15d6c15b0f00a08.pdf"
  }
}
